name,short_card_name,trademark_card_name,issuer_name,processor,balance_transfer_apr,balance_transfer_apr_chips,balance_transfer_apr_followup_question,cash_advance_apr,cash_advance_apr_chips,cash_advance_apr_followup_question,penalty_apr,penalty_apr_chips,penalty_apr_followup_question,purchase_apr,purchase_apr_chips,purchase_apr_followup_question,minimum_interest_charge_apr,minimum_interest_charge_apr_chips,minimum_interest_charge_apr_followup_question,annual_fee,annual_fee_chips,annual_fee_followup_question,balance_transfer_fee,balance_transfer_fee_chips,balance_transfer_fee_followup_question,cash_advance_fee,cash_advance_fee_chips,cash_advance_fee_followup_question,foreign_transaction_fee,foreign_transaction_fee_chips,foreign_transaction_fee_followup_question,late_payment_fee,late_payment_fee_chips,late_payment_fee_followup_question,returned_payment_fee,returned_payment_fee_chips,returned_payment_fee_followup_question,returned_check_fee,returned_check_fee_chips,returned_check_fee_followup_question,over_limit_fee,over_limit_fee_chips,over_limit_fee_followup_question,pros,pros_chips,pros_followup_question,cons,cons_chips,cons_followup_question,credit_score,credit_score_chips,credit_score_followup_question,bonus_offer,bonus_offer_chips,bonus_offer_followup_question,rewards_rate,rewards_rate_chips,rewards_rate_followup_question,image_link,fb_horizontal_link,issuer_phrase,score,score_response,score_response_chips,score_response_followup_question,billing_and_payment_quality,billing_and_payment_quality_chips,billing_and_payment_quality_followup_question,credit_card_terms,credit_card_terms_chips,credit_card_terms_followup_question,customer_service,customer_service_chips,customer_service_followup_question,problem_resolution,problem_resolution_chips,problem_resolution_followup_question,rewards_quality,rewards_quality_chips,rewards_quality_followup_question,overall_satisfaction,overall_satisfaction_chips,overall_satisfaction_followup_question,similar_cards,category
Gold Delta SkyMiles Business Credit Card from American Express,Gold Delta SkyMiles ,Gold Delta SkyMiles® Business Credit Card from American Express,American Express,American Express,American Express does not disclose the balance transfer A P R for the Gold Delta SkyMiles Business Credit Card from American Express.,"['Apply for this card', 'Rewards for this card', 'See issuer site', 'Compare cards', 'Save this card', 'Start over']","Ask me how to apply for this card, or compare with another card?",The Gold Delta SkyMiles Business Credit Card from American Express has a cash advance A P R of 26.99%.,"['Apply for this card', 'Rewards for this card', 'Compare cards', 'Save this card', 'Start over']","Ask me how to apply for this card, or compare with another card?",The Gold Delta SkyMiles Business Credit Card from American Express has a penalty A P R of 29.99%.,"['How do I apply', 'Compare cards', 'Card Report', 'Save this card', 'What is the late fee?', 'Start over']","Ask me how to apply for this card, or ask me to compare other cards?",The Gold Delta SkyMiles Business Credit Card from American Express has a purchase A P R of 16.99%.,"['How do I apply', 'Compare cards', 'Card Report', 'Save this card', 'What is the late fee?', 'Start over']","Ask me how to apply for this card, or ask me to compare other cards?",American Express does not disclose the minimum interest charge for the Gold Delta SkyMiles Business Credit Card from American Express.,"['Apply for this card', 'Rewards for this card', 'See issuer site', 'Compare cards', 'Save this card', 'Start over']","Ask me how to apply for this card, or ask me to compare other cards?","The Gold Delta SkyMiles Business Credit Card from American Express has an annual fee of $0 for the first year, then $95.","['Apply for this card', 'Rewards for this card', 'Compare cards', 'Save this card', 'Start over']","Ask me how to apply for this card, or compare with another card?",American Express does not disclose the balance transfers fee for the Gold Delta SkyMiles Business Credit Card from American Express.,"['Apply for this card', 'Rewards for this card', 'See issuer site', 'Compare cards', 'Save this card', 'Start over']","Ask me how to apply for this card, or compare with another card?","The Gold Delta SkyMiles Business Credit Card from American Express has a cash advances fee of either 3% of each advance or $5, whichever is greater.","['Apply for this card', 'Rewards for this card', 'Compare cards', 'Save this card', 'Start over']","Ask me how to apply for this card, or compare with another card?",The Gold Delta SkyMiles Business Credit Card from American Express has no foreign transaction fee.,"['Apply for this card', 'Rewards for this card', 'Compare cards', 'Save this card', 'Start over']","Ask me how to apply for this card, or ask me to compare other cards?",The Gold Delta SkyMiles Business Credit Card from American Express has a late payment fee of $38.,"['APR for this card', 'Card Report', 'How do I apply', 'Save this card', 'Start over']","Ask me how to apply for this card, or ask me to compare other cards?",The Gold Delta SkyMiles Business Credit Card from American Express has a returned payment fee of $38.,"['How do I apply', 'Compare cards', 'Save this card', 'What is the sign-on bonus?', 'Start over']","Ask me how to apply for this card, or ask me to compare other cards?",American Express does not disclose the returned check fee for the Gold Delta SkyMiles Business Credit Card from American Express.,"['How do I apply', 'Compare cards', 'See issuer site', 'Save this card', 'What is the sign-on bonus?', 'Start over']","Ask me how to apply for this card, or ask me to compare other cards?",The Gold Delta SkyMiles Business Credit Card from American Express has no over limit fee.,"['Apply for this card', 'Rewards for this card', 'Compare cards', 'Save this card', 'Start over']","Ask me how to apply for this card, or ask me to compare other cards?",The Gold Delta SkyMiles Business Credit Card from American Express has these pros: Perks like priority boarding and first checked bags free; No annual fee; double miles,"['Cons of this card', 'How do I apply', 'Card Report', 'APR of this card', 'Compare cards', 'Start over']","Ask me about the cons of this card, or ask me how to apply?","The Gold Delta SkyMiles Business Credit Card from American Express has these cons: No annual fee for the first year, then $95.","['Pros of this card', 'Card Report', 'Annual fee for this card', 'How do I apply', 'Start over']",Ask me about the pros or ask me how to apply for this card?,The Gold Delta SkyMiles Business Credit Card from American Express has a recommended credit score range of 690 to 850.,"['How do I apply', 'Compare cards', 'Card Report', 'Save this card', 'Start over']",Ask me about the pros or ask me how to apply for this card?,The Gold Delta SkyMiles Business Credit Card from American Express has the following bonus offer value: 30k miles after spending 1k.,"['How do I apply', 'Compare cards', 'Card Report', 'Save this card', 'What is the late fee?', 'Start over']","Ask me how to apply for this card, or ask me to compare other cards?",The Gold Delta SkyMiles Business Credit Card from American Express has a rewards rate value of 1.00%; 2 Miles per dollar on Delta purchases; 1 Mile per dollar on everything else.,"['How do I apply', 'Compare cards', 'Card Report', 'Save this card', 'What is the late fee?', 'Start over']","Ask me how to apply for this card, or ask me to compare other cards?",https://s3-us-west-2.amazonaws.com/static.starbutter.com/images/card/Gold+Delta+SkyMiles+Business+Credit+Card+from+American+Express.jpg,https://s3-us-west-2.amazonaws.com/static.starbutter.com/images/card/facebook_horiz/Gold+Delta+SkyMiles+Business+Credit+Card+from+American+Express.jpg,American Express issues Gold Delta SkyMiles Business Credit Card from American Express,90,"The Gold Delta SkyMiles Business Credit Card from American Express has a CardScore of 90 out of 100. We looked at many cards and rated them after comparing the terms, complaint data, reviews.","['How do I apply', 'Compare cards', 'Card Report', 'Save this card', 'What is the late fee?', 'Start over']","Ask me how to apply for this card, or ask me to compare other cards?",Our research found that Gold Delta SkyMiles Business Credit Card from American Express is excellent at handling billing and accepting payments.,"['Browse Cards', 'Compare Cards', 'Fast Search']","Ask me about cards from this issuer, or browse cards by category?",Our research found that Gold Delta SkyMiles Business Credit Card from American Express's credit card terms are good.,"['Compare Cards', 'Find a Card', 'Fast Search']","Ask me about cards from this issuer, or browse cards by category?",Our research found that Gold Delta SkyMiles Business Credit Card from American Express's customer service is good.,"['Compare Cards', 'Find a Card', 'Fast Search']","Ask me about cards from this issuer, or browse cards by category?",Our research found that Gold Delta SkyMiles Business Credit Card from American Express's problem resolution is excellent.,"['Browse Cards', 'Compare Cards', 'Fast Search']","Ask me about cards from this issuer, or browse cards by category?",Our research found that Gold Delta SkyMiles Business Credit Card from American Express's rewards quality is excellent.,"['Browse Cards', 'Compare Cards', 'Fast Search']","Ask me about cards from this issuer, or browse cards by category?",Our research found that the overall customer satisfaction for Gold Delta SkyMiles Business Credit Card from American Express is good.,"['Compare Cards', 'Find a Card', 'Fast Search']","Ask me about cards from this issuer, or browse cards by category?","['Starwood Preferred Guest Business Credit Card from American Express', 'Ink Business Cash Credit Card', 'Blue Business Plus Credit Card from American Express']","miles, travel"
Virgin Atlantic White Credit Card,Virgin Atlantic White,Virgin Atlantic White Credit Card,Bank of America,Mastercard,The Virgin Atlantic White Credit Card has a balance transfer A P R of 16.74% to 24.74% .,"['Apply for this card', 'Rewards for this card', 'Compare cards', 'Save this card', 'Start over']","Ask me how to apply for this card, or compare with another card?","The Virgin Atlantic White Credit Card has a cash advance A P R of 19.74% to 26.74% for Direct Deposit and Check Cash Advances, 26.74% for Bank Cash Advances.","['Apply for this card', 'Rewards for this card', 'Compare cards', 'Save this card', 'Start over']","Ask me how to apply for this card, or compare with another card?",The Virgin Atlantic White Credit Card has a penalty A P R of 29.99%.,"['How do I apply', 'Compare cards', 'Card Report', 'Save this card', 'What is the late fee?', 'Start over']","Ask me how to apply for this card, or ask me to compare other cards?",The Virgin Atlantic White Credit Card has a purchase A P R of 16.74% to 24.74%.,"['How do I apply', 'Compare cards', 'Card Report', 'Save this card', 'What is the late fee?', 'Start over']","Ask me how to apply for this card, or ask me to compare other cards?",The Virgin Atlantic White Credit Card has a minimum interest charge of $1.50.,"['Apply for this card', 'Rewards for this card', 'Compare cards', 'Save this card', 'Start over']","Ask me how to apply for this card, or ask me to compare other cards?",The Virgin Atlantic White Credit Card has an annual fee of $49.,"['Apply for this card', 'Rewards for this card', 'Compare cards', 'Save this card', 'Start over']","Ask me how to apply for this card, or compare with another card?","The Virgin Atlantic White Credit Card has a balance transfers fee of either 3% of each transfer or $11, whichever is greater.","['Apply for this card', 'Rewards for this card', 'Compare cards', 'Save this card', 'Start over']","Ask me how to apply for this card, or compare with another card?","The Virgin Atlantic White Credit Card has a cash advances fee of either 3% of each advance or $11, whichever is greater.","['Apply for this card', 'Rewards for this card', 'Compare cards', 'Save this card', 'Start over']","Ask me how to apply for this card, or compare with another card?",The Virgin Atlantic White Credit Card has no foreign transaction fee.,"['Apply for this card', 'Rewards for this card', 'Compare cards', 'Save this card', 'Start over']","Ask me how to apply for this card, or ask me to compare other cards?",The Virgin Atlantic White Credit Card has a late payment fee of $38.,"['APR for this card', 'Card Report', 'How do I apply', 'Save this card', 'Start over']","Ask me how to apply for this card, or ask me to compare other cards?",The Virgin Atlantic White Credit Card has a returned payment fee of $27.,"['How do I apply', 'Compare cards', 'Save this card', 'What is the sign-on bonus?', 'Start over']","Ask me how to apply for this card, or ask me to compare other cards?",Bank of America does not disclose the returned check fee for the Virgin Atlantic White Credit Card.,"['How do I apply', 'Compare cards', 'See issuer site', 'Save this card', 'What is the sign-on bonus?', 'Start over']","Ask me how to apply for this card, or ask me to compare other cards?",Bank of America does not disclose the over limit fee for the Virgin Atlantic White Credit Card.,"['Apply for this card', 'Rewards for this card', 'See issuer site', 'Compare cards', 'Save this card', 'Start over']","Ask me how to apply for this card, or ask me to compare other cards?",The Virgin Atlantic White Credit Card has these pros: Travel rewards for Virgin are decent,"['Cons of this card', 'How do I apply', 'Card Report', 'APR of this card', 'Compare cards', 'Start over']","Ask me about the cons of this card, or ask me how to apply?",The Virgin Atlantic White Credit Card has these cons: Has annual fee.,"['Pros of this card', 'Card Report', 'Annual fee for this card', 'How do I apply', 'Start over']",Ask me about the pros or ask me how to apply for this card?,The Virgin Atlantic White Credit Card has no recommended credit score range.,"['How do I apply', 'Compare cards', 'See issuer site', 'Card Report', 'Save this card', 'Start over']",Ask me about the pros or ask me how to apply for this card?,The Virgin Atlantic White Credit Card has the following bonus offer value: 12.5k miles after first purchase.,"['How do I apply', 'Compare cards', 'Card Report', 'Save this card', 'What is the late fee?', 'Start over']","Ask me how to apply for this card, or ask me to compare other cards?",The Virgin Atlantic White Credit Card has a rewards rate value of 3 miles per dollar on Vigin Atlantic purchases; 1.5 miles per dollar all else.,"['How do I apply', 'Compare cards', 'Card Report', 'Save this card', 'What is the late fee?', 'Start over']","Ask me how to apply for this card, or ask me to compare other cards?",https://s3-us-west-2.amazonaws.com/static.starbutter.com/images/card/Virgin+Atlantic+White+Credit+Card.jpg,https://s3-us-west-2.amazonaws.com/static.starbutter.com/images/card/facebook_horiz/Virgin+Atlantic+White+Credit+Card.jpg,Bank of America issues Virgin Atlantic White Credit Card,72,"The Virgin Atlantic White Credit Card has a CardScore of 72 out of 100. We looked at many cards and rated them after comparing the terms, complaint data, reviews.","['How do I apply', 'Compare cards', 'Card Report', 'Save this card', 'What is the late fee?', 'Start over']","Ask me how to apply for this card, or ask me to compare other cards?",Our research found that Virgin Atlantic White Credit Card is about average at handling billing and accepting payments.,"['Find a Card', 'Fast Search', 'Browse Cards']","Ask me about cards from this issuer, or browse cards by category?",Our research found that Virgin Atlantic White Credit Card's credit card terms are about average.,"['Find a Card', 'Fast Search', 'Browse Cards']","Ask me about cards from this issuer, or browse cards by category?",Our research found that Virgin Atlantic White Credit Card's customer service is about average.,"['Find a Card', 'Fast Search', 'Browse Cards']","Ask me about cards from this issuer, or browse cards by category?",Our research found that Virgin Atlantic White Credit Card's problem resolution is about average.,"['Find a Card', 'Fast Search', 'Browse Cards']","Ask me about cards from this issuer, or browse cards by category?",Our research found that Virgin Atlantic White Credit Card's rewards quality is about average.,"['Find a Card', 'Fast Search', 'Browse Cards']","Ask me about cards from this issuer, or browse cards by category?",Our research found that the overall customer satisfaction for Virgin Atlantic White Credit Card is below average.,"['Compare Cards', 'Best Cashback', 'Find a Card']","Ask me about cards from this issuer, or browse cards by category?","['Starwood Preferred Guest Credit Card from American Express', 'Gold Delta SkyMiles Credit Card from American Express', 'Discover it Miles']",miles
SimplyCash Plus Business Credit Card from American Express,SimplyCash Plus,SimplyCash® Plus Business Credit Card from American Express,American Express,American Express,American Express does not disclose the balance transfer A P R for the SimplyCash Plus Business Credit Card from American Express.,"['Apply for this card', 'Rewards for this card', 'See issuer site', 'Compare cards', 'Save this card', 'Start over']","Ask me how to apply for this card, or compare with another card?",American Express does not disclose the cash advance A P R for the SimplyCash Plus Business Credit Card from American Express.,"['Apply for this card', 'Rewards for this card', 'See issuer site', 'Compare cards', 'Save this card', 'Start over']","Ask me how to apply for this card, or compare with another card?",The SimplyCash Plus Business Credit Card from American Express has a penalty A P R of 29.99%.,"['How do I apply', 'Compare cards', 'Card Report', 'Save this card', 'What is the late fee?', 'Start over']","Ask me how to apply for this card, or ask me to compare other cards?","The SimplyCash Plus Business Credit Card from American Express has a purchase A P R of 0% for the first 9 months. After that, 13.99%, 18.99%, or 20.99%.","['How do I apply', 'Compare cards', 'Card Report', 'Save this card', 'What is the late fee?', 'Start over']","Ask me how to apply for this card, or ask me to compare other cards?",American Express does not disclose the minimum interest charge for the SimplyCash Plus Business Credit Card from American Express.,"['Apply for this card', 'Rewards for this card', 'See issuer site', 'Compare cards', 'Save this card', 'Start over']","Ask me how to apply for this card, or ask me to compare other cards?",The SimplyCash Plus Business Credit Card from American Express has no annual fee.,"['Apply for this card', 'Rewards for this card', 'Compare cards', 'Save this card', 'Start over']","Ask me how to apply for this card, or compare with another card?",American Express does not disclose the balance transfers fee for the SimplyCash Plus Business Credit Card from American Express.,"['Apply for this card', 'Rewards for this card', 'See issuer site', 'Compare cards', 'Save this card', 'Start over']","Ask me how to apply for this card, or compare with another card?",American Express does not disclose the cash advances fee for the SimplyCash Plus Business Credit Card from American Express.,"['Apply for this card', 'Rewards for this card', 'See issuer site', 'Compare cards', 'Save this card', 'Start over']","Ask me how to apply for this card, or compare with another card?",The SimplyCash Plus Business Credit Card from American Express has a foreign transaction fee of 2.7%.,"['Apply for this card', 'Rewards for this card', 'Compare cards', 'Save this card', 'Start over']","Ask me how to apply for this card, or ask me to compare other cards?",The SimplyCash Plus Business Credit Card from American Express has a late payment fee of $38.,"['APR for this card', 'Card Report', 'How do I apply', 'Save this card', 'Start over']","Ask me how to apply for this card, or ask me to compare other cards?",The SimplyCash Plus Business Credit Card from American Express has a returned payment fee of $38.,"['How do I apply', 'Compare cards', 'Save this card', 'What is the sign-on bonus?', 'Start over']","Ask me how to apply for this card, or ask me to compare other cards?",American Express does not disclose the returned check fee for the SimplyCash Plus Business Credit Card from American Express.,"['How do I apply', 'Compare cards', 'See issuer site', 'Save this card', 'What is the sign-on bonus?', 'Start over']","Ask me how to apply for this card, or ask me to compare other cards?",The SimplyCash Plus Business Credit Card from American Express has no over limit fee.,"['Apply for this card', 'Rewards for this card', 'Compare cards', 'Save this card', 'Start over']","Ask me how to apply for this card, or ask me to compare other cards?",The SimplyCash Plus Business Credit Card from American Express has these pros: Bonus cash back categories; 0% intro APR for short time; No annual fee,"['Cons of this card', 'How do I apply', 'Card Report', 'APR of this card', 'Compare cards', 'Start over']","Ask me about the cons of this card, or ask me how to apply?",The SimplyCash Plus Business Credit Card from American Express has these cons: A complicated rewards system; Spotty customer service at times.,"['Pros of this card', 'Card Report', 'Annual fee for this card', 'How do I apply', 'Start over']",Ask me about the pros or ask me how to apply for this card?,The SimplyCash Plus Business Credit Card from American Express has a recommended credit score range of 690 to 850.,"['How do I apply', 'Compare cards', 'Card Report', 'Save this card', 'Start over']",Ask me about the pros or ask me how to apply for this card?,The SimplyCash Plus Business Credit Card from American Express has no bonus offer value.,"['How do I apply', 'Compare cards', 'See issuer site', 'Card Report', 'Save this card', 'What is the late fee?', 'Start over']","Ask me how to apply for this card, or ask me to compare other cards?",The SimplyCash Plus Business Credit Card from American Express has a rewards rate value of 5% on office supplies and wireless phone services; 3% on select others; 1% on all else.,"['How do I apply', 'Compare cards', 'Card Report', 'Save this card', 'What is the late fee?', 'Start over']","Ask me how to apply for this card, or ask me to compare other cards?",https://s3-us-west-2.amazonaws.com/static.starbutter.com/images/card/SimplyCash+Plus+Business+Credit+Card+from+American+Express.jpg,https://s3-us-west-2.amazonaws.com/static.starbutter.com/images/card/facebook_horiz/SimplyCash+Plus+Business+Credit+Card+from+American+Express.jpg,American Express issues SimplyCash Plus Business Credit Card from American Express,92,"The SimplyCash Plus Business Credit Card from American Express has a CardScore of 92 out of 100. We looked at many cards and rated them after comparing the terms, complaint data, reviews.","['How do I apply', 'Compare cards', 'Card Report', 'Save this card', 'What is the late fee?', 'Start over']","Ask me how to apply for this card, or ask me to compare other cards?",Our research found that SimplyCash Plus Business Credit Card from American Express is excellent at handling billing and accepting payments.,"['Browse Cards', 'Compare Cards', 'Fast Search']","Ask me about cards from this issuer, or browse cards by category?",Our research found that SimplyCash Plus Business Credit Card from American Express's credit card terms are good.,"['Compare Cards', 'Find a Card', 'Fast Search']","Ask me about cards from this issuer, or browse cards by category?",Our research found that SimplyCash Plus Business Credit Card from American Express's customer service is good.,"['Compare Cards', 'Find a Card', 'Fast Search']","Ask me about cards from this issuer, or browse cards by category?",Our research found that SimplyCash Plus Business Credit Card from American Express's problem resolution is excellent.,"['Browse Cards', 'Compare Cards', 'Fast Search']","Ask me about cards from this issuer, or browse cards by category?",Our research found that SimplyCash Plus Business Credit Card from American Express's rewards quality is excellent.,"['Browse Cards', 'Compare Cards', 'Fast Search']","Ask me about cards from this issuer, or browse cards by category?",Our research found that the overall customer satisfaction for SimplyCash Plus Business Credit Card from American Express is good.,"['Compare Cards', 'Find a Card', 'Fast Search']","Ask me about cards from this issuer, or browse cards by category?","['Starwood Preferred Guest Business Credit Card from American Express', 'Ink Business Cash Credit Card', 'Blue Business Plus Credit Card from American Express']","business, cash_back"
